story_id	area	feature	user_story	expected_behavior	code_evidence	existing_test_evidence	status	test_state	priority	risk_notes	error_id	error_notes	fix_status	retest_status
DISC-007	Discover	Subscribe visible lists	As a user I want bulk subscription to affect only the visible compatible rows after filters.	Discover bulk subscribe sends selected visible FilterLists IDs to FilterListsSubscribeAllWorker and subscribed rows can resolve from durable FilterLists source metadata when cache is cold.	app/src/main/java/org/adaway/ui/discover/DiscoverFilterListsFragment.java; app/src/main/java/org/adaway/ui/hosts/FilterListsSubscribeAllWorker.java	app/src/test/java/org/adaway/ui/hosts/FilterListsSubscribeAllWorkerTest.java; app/src/androidTest/java/org/adaway/ui/hosts/FilterListsSubscribeAllWorkerRoomTest.java; app/src/test/java/org/adaway/ui/discover/DiscoverPresetSubscriptionTest.java; app/src/androidTest/java/org/adaway/ui/hosts/FilterListsVisibleBulkActionsInstrumentedTest.java	Covered by connected UI flow	Focused visible bulk subscribe/remove flow passed with deterministic FilterLists data	P0	Visible bulk subscription is now device-proven for filtered compatible rows; broader visual matrix remains separate.	UX-OPEN-DISCOVER-FILTERLISTS-METADATA-CACHE	Subscribed FilterLists rows depended on transient URL cache for row state after restart/cache miss; fixed earlier durable filterListId selected-URL fallback, and connected visible-scope proof added here.	Verified existing behavior	Focused connected visible bulk-actions test, standard Gradle gate, and full connected retest passed
DISC-008	Discover	Bulk remove	As a user I want visible or all FilterLists sources removable with confirmation.	DiscoverFilterListsFragment shows confirm remove dialogs, resolves visible source URLs from durable FilterLists metadata, and reports removed count.	app/src/main/java/org/adaway/ui/discover/DiscoverFilterListsFragment.java; app/src/main/res/values/strings_filter_catalog.xml	app/src/test/java/org/adaway/ui/discover/DiscoverPresetSubscriptionTest.java; app/src/androidTest/java/org/adaway/ui/hosts/FilterListsVisibleBulkActionsInstrumentedTest.java	Covered by connected UI flow	Focused visible bulk subscribe/remove flow passed and preserved a hidden subscribed FilterLists source	P1	Destructive visible remove is now device-proven for filtered scope; all-sources removal remains source-contract covered.	UX-OPEN-DISCOVER-FILTERLISTS-METADATA-CACHE	Visible bulk remove could miss subscribed FilterLists sources when transient URL cache data was cold or stale; fixed earlier durable filterListId selected-URL fallback, and connected visible-scope proof added here.	Verified existing behavior	Focused connected visible bulk-actions test, standard Gradle gate, and full connected retest passed
DISC-009	Discover	Bulk progress cancel retry	As a user I want bulk list subscription progress cancellation retry and review summary.	Worker outputs counts and review data while UI shows running stopping cancelled and retry states.	app/src/main/java/org/adaway/ui/discover/DiscoverFilterListsFragment.java; app/src/main/java/org/adaway/ui/hosts/FilterListsSubscribeAllWorker.java; app/src/androidTest/java/org/adaway/ui/hosts/FilterListsBulkUiInstrumentedTest.java	app/src/test/java/org/adaway/ui/hosts/FilterListsSubscribeAllWorkerTest.java; app/src/test/java/org/adaway/ui/discover/DiscoverPresetSubscriptionTest.java; app/src/androidTest/java/org/adaway/ui/hosts/FilterListsSubscribeAllWorkerDoWorkTest.java; app/src/androidTest/java/org/adaway/ui/hosts/FilterListsBulkUiInstrumentedTest.java	Covered by connected UI and worker tests	Focused retry progress cancel review UI path plus standard and full connected gates passed after adding a synchronous UI cancel marker	P1	Large-directory perceived hang risk now has device-level cancel proof; broader scale/perf benchmarks remain separate.	UX-OPEN-DISCOVER-FILTERLISTS-BULK-CANCEL	Full-suite order exposed a cancellation race where resolved detail results could still insert a source and enqueue update after the user cancelled.	Fixed in current slice	Focused affected connected, standard Gradle, and full connected retests passed
DISC-010	Discover	Unsupported list review	As a user I want unsupported lists explained and optionally added manually.	UI fetches details for unsupported rows and shows syntax capability summary plus manual add when URL exists.	app/src/main/java/org/adaway/ui/discover/DiscoverFilterListsFragment.java; app/src/main/java/org/adaway/model/source/FilterListCompatibility.java	app/src/test/java/org/adaway/model/source/FilterListCompatibilityTest.java; app/src/androidTest/java/org/adaway/ui/discover/DiscoverUnsupportedReviewInstrumentedTest.java	Covered by connected UI test	Focused unsupported-review dialog and manual-add source-editor flow passed with deterministic FilterLists data	P2	Clarity prevents false compatibility claims.	UX-OPEN-DISCOVER-FILTERLISTS-UNSUPPORTED-REVIEW	Unsupported manual review had only source-text coverage and no device proof for resolved details, disclosure copy, or manual-add intent extras.	Test added in current slice	Focused DISC-010 connected, affected connected pair, standard Gradle, and full connected retests passed
NAV-001	Navigation	Discover deep entry	As a user I want app links and Home CTAs to open Discover directly when appropriate.	HomeActivity accepts EXTRA_NAV_DISCOVER and HomeFragment no-source and progress text entry points navigate to Discover.	app/src/main/java/org/adaway/ui/home/HomeActivity.java; app/src/main/java/org/adaway/ui/home/HomeFragment.java	app/src/androidTest/java/org/adaway/ui/UxDeviceMatrixTest.java; app/src/androidTest/java/org/adaway/ui/home/HomeDiscoverDeepEntryInstrumentedTest.java	Covered by connected UI flow	Focused direct Discover launch and no-source Home CTA flows passed	P1	Direct launch and Home no-source CTA are now device-proven; FilterLists progress-text entry remains source-level covered.	UX-OPEN-HOME-DISCOVER-DEEP-ENTRY	Explorer found no direct assertion for EXTRA_NAV_DISCOVER behavior; this slice added the connected launch proof and Home CTA proof without production code changes.	Verified existing behavior	Focused connected HomeDiscoverDeepEntryInstrumentedTest, standard Gradle gate, and full connected retest passed
SRC-001	Sources	Categorized source list	As a user I want subscribed sources grouped into readable categories.	HostsSourcesFragment uses CategorizedSourcesAdapter and expandable category rows.	app/src/main/java/org/adaway/ui/hosts/HostsSourcesFragment.java; app/src/main/java/org/adaway/ui/hosts/CategorizedSourcesAdapter.java	app/src/test/java/org/adaway/ui/hosts/CategorizedSourcesAdapterTest.java; app/src/androidTest/java/org/adaway/ui/UxDeviceMatrixTest.java	Covered by visual matrix and unit contract	Full UX matrix passed Sources screenshots across baseline 1.3 1.6 1.3-RTL and 1.6-RTL; 1.6 Sources screenshot was visually inspected	P1	Main management surface is now large-font/RTL smoke-proven; final human review remains under REL-004.		No production defect found; prior gap was missing large-font visual evidence.	Verified existing behavior	Full run-ux-matrix.ps1 passed all 5 variants and generated Sources screenshots for every variant
SRC-002	Sources	Enable disable source	As a user I want to toggle a source and apply the changed protection.	Source rows update enabled state; ApplyConfigurationSnackbar shows pending applying success and failure feedback while applying changed protection.	app/src/main/java/org/adaway/ui/hosts/HostsSourcesFragment.java; app/src/main/java/org/adaway/ui/adblocking/ApplyConfigurationSnackbar.java; app/src/main/res/values/strings.xml	app/src/test/java/org/adaway/ui/adblocking/ApplyConfigurationSnackbarContractTest.java; app/src/androidTest/java/org/adaway/ui/hosts/SourcesToggleApplyInstrumentedTest.java	Covered by connected UI flow	Connected Sources checked-change/apply flow passed	P0	Device-proven for deterministic local source: real Sources screen, displayed row switch checked-change listener, pending apply snackbar, hosts_sources disabled, hosts_lists rows disabled, and AdBlockModel.apply reached; low-level tap dispatch and real network update-all remain under SRC-005/RUNTIME.	UX-OPEN-SOURCE-APPLY-FEEDBACK	Successful apply after source changes had no distinct confirmation and Sources update/apply could reuse pending-configuration copy; fixed by adding applied-success feedback and now device-proven for pending apply boundary.	Device-proven in working tree	Focused connected Sources toggle/apply test passed; standard local Gradle test passed
SRC-003	Sources	Add custom source	As a user I want to add a custom hosts source URL.	HostsSourcesFragment opens add options and SourceEditActivity edits source details.	app/src/main/java/org/adaway/ui/hosts/HostsSourcesFragment.java; app/src/main/java/org/adaway/ui/source/SourceEditActivity.java	app/src/androidTest/java/org/adaway/ui/source/SourceEditAddEditInstrumentedTest.java	Covered by connected UI flow	Focused source add/edit connected test passed	P1	Real Sources FAB/add-options sheet/SourceEdit add flow is device-proven for invalid HTTP URL rejection and valid HTTPS source persistence; file picker path remains outside this URL story.	SRC-EDIT-FINISH-THREAD	SourceEditActivity applied save by calling finish() from diskIO, which exposed lifecycle idle hangs around save/close.	Fixed in working tree	Focused connected source add/edit test passed
SRC-004	Sources	Edit source metadata	As a user I want to edit source name, URL, and format metadata safely.	SourceEditActivity pre-fills existing source data, validates edits, saves replacement HostsSource rows, and leaves enable/disable ownership to the Sources row switch covered by SRC-002.	app/src/main/java/org/adaway/ui/source/SourceEditActivity.java; app/src/main/res/layout/source_edit_activity.xml	app/src/androidTest/java/org/adaway/ui/source/SourceEditAddEditInstrumentedTest.java	Covered by connected UI flow	Focused source add/edit connected test passed	P1	Existing source card -> editor prefill -> edited label/URL/allow metadata replacement is device-proven; source enabled state is intentionally tracked under SRC-002.	SRC-EDIT-FINISH-THREAD	SourceEditActivity applied save by calling finish() from diskIO, which exposed lifecycle idle hangs around save/close.	Fixed in working tree	Focused connected source add/edit test passed
SRC-005	Sources	Update all sources	As a user I want a menu action to refresh all subscribed sources.	HostsSourcesFragment action_hosts_update_all triggers all-sources update then applies protection with explicit update/apply copy and running feedback.	app/src/main/java/org/adaway/ui/hosts/HostsSourcesFragment.java; app/src/main/res/menu/hosts_sources_menu.xml; app/src/main/res/values/strings.xml	app/src/test/java/org/adaway/ui/hosts/HostsSourcesActionsContractTest.java; app/src/androidTest/java/org/adaway/model/source/SourceUpdateServiceWorkManagerTest.java; app/src/androidTest/java/org/adaway/ui/hosts/SourcesUpdateAllInstrumentedTest.java	Covered by connected UI flow	Connected Sources toolbar update-all action flow passed	P0	Device-proven for deterministic local source: real Home/Sources navigation, toolbar menu action dispatch, source-specific running copy, all-sources SourceModel branch, runtime truth sync, and AdBlockModel.apply ordering; real network update-all remains under RUNTIME-001/RUNTIME-010.	UX-OPEN-SOURCES-UPDATE-ALL	Update-all menu copy hid that protection is applied and running feedback looked like generic configuration apply; fixed explicit update/apply copy and source-update running message, now device-proven for deterministic update-all dispatch and apply ordering.	Device-proven in working tree	Focused connected SourcesUpdateAllInstrumentedTest passed; focused HomeCountersInstrumentedTest passed after WorkManager isolation patch; full connected Android suite passed with 152 finished, 3 skipped, 0 failed; standard local Gradle test passed
SRC-006	Sources	Save filter set	As a user I want to save current enabled source URLs as a named profile.	HostsSourcesFragment validates set name and FilterSetStore saves enabled URLs.	app/src/main/java/org/adaway/ui/hosts/HostsSourcesFragment.java; app/src/main/java/org/adaway/ui/hosts/FilterSetStore.java	app/src/test/java/org/adaway/ui/hosts/FilterSetStoreTest.java; app/src/androidTest/java/org/adaway/ui/hosts/FilterSetSaveApplyInstrumentedTest.java	Covered by connected UI flow	Focused filter-set save/apply connected test passed	P1	Real Sources toolbar save dialog is device-proven for empty-name validation, named set persistence, saved enabled URL membership, and active-profile marking.	UX-PROOF-FILTER-SET-SAVE-APPLY	No production defect found; first red run exposed only an ActivityScenario global-idle harness issue after dialog interaction.	Device-proven existing behavior	Focused connected FilterSetSaveApplyInstrumentedTest passed; standard local Gradle test passed; full connected Android suite passed
SRC-007	Sources	Apply filter set	As a user I want to preview enable disable keep and missing counts before applying a profile.	FilterProfileDiff resolves changes and confirmation warns on empty missing-only or weakening protection.	app/src/main/java/org/adaway/ui/hosts/HostsSourcesFragment.java; app/src/main/java/org/adaway/ui/hosts/FilterProfileDiff.java	app/src/test/java/org/adaway/ui/hosts/FilterProfileStateTest.java; app/src/androidTest/java/org/adaway/ui/hosts/FilterSetSaveApplyInstrumentedTest.java	Covered by connected UI flow	Focused filter-set save/apply connected test passed	P1	Real Sources toolbar apply dialog is device-proven for saved-set selection, preview counts, disable warning, apply confirmation, hosts_sources changes, hosts_lists row changes, and active-profile marking.	UX-PROOF-FILTER-SET-SAVE-APPLY	No production defect found; first red run exposed only an ActivityScenario global-idle harness issue after dialog interaction.	Device-proven existing behavior	Focused connected FilterSetSaveApplyInstrumentedTest passed; standard local Gradle test passed; full connected Android suite passed
SRC-008	Sources	Manage filter sets	As a user I want to rename or delete saved profiles with validation.	HostsSourcesFragment lists only manageable saved sets, rejects reserved rename targets, persists rename URL membership schedule and active profile, and confirms destructive delete.	app/src/main/java/org/adaway/ui/hosts/HostsSourcesFragment.java; app/src/main/java/org/adaway/ui/hosts/FilterSetStore.java; app/src/androidTest/java/org/adaway/ui/hosts/FilterSetSaveApplyInstrumentedTest.java	app/src/test/java/org/adaway/ui/hosts/FilterSetStoreTest.java; app/src/androidTest/java/org/adaway/ui/hosts/FilterSetSaveApplyInstrumentedTest.java	Covered by connected UI flow	Focused manage-filter-set method and full FilterSetSaveApplyInstrumentedTest passed locally; PR CI exposed snackbar-only assertion on 49bb80d5; hardened durable store assertion passed PR CI on f93a5142	P2	Management polish now has device proof for manageable-set filtering, reserved-name validation, rename persistence, schedule carryover, active-profile rename, delete confirmation, and no remaining user-managed sets.			Verified existing behavior with manage-dialog coverage; hardened full-suite assertion	Focused connected method passed 1 test after hardening; affected connected FilterSetSaveApplyInstrumentedTest plus AboutActivitySmokeInstrumentedTest passed 4 tests on adaway-api34-16g; PR #6 connected Android tests passed on f93a5142
SRC-009	Sources	Schedule filter set	As a user I want saved profiles to update on a schedule.	HostsSourcesFragment exposes schedule actions and FilterSetUpdateService schedules a unique periodic worker after a saved set receives a schedule.	app/src/main/java/org/adaway/ui/hosts/HostsSourcesFragment.java; app/src/main/java/org/adaway/ui/hosts/FilterSetUpdateService.java; app/src/main/java/org/adaway/ui/hosts/SchedulesActivity.java	app/src/androidTest/java/org/adaway/ui/hosts/FilterSetUpdateServiceWorkManagerTest.java; app/src/androidTest/java/org/adaway/ui/hosts/FilterSetSaveApplyInstrumentedTest.java	Covered by connected UI flow	Connected saved-set daily schedule UI flow passed	P1	Scheduled changes can surprise users; daily saved-set scheduling is now device-proven from Sources toolbar through TimePicker and WorkManager state.	UX-OPEN-SRC-SCHEDULE-FILTER-SET	Saved filter-set schedule behavior had WorkManager coverage but no connected proof that the Sources toolbar UI persists a schedule and enqueues work.	Device-proven existing behavior	Focused connected FilterSetSaveApplyInstrumentedTest schedule method passed 1 test on adaway-api34-16g after dialog click helper fallback
SRC-010	Sources	Delete source	As a user I want deleting a source to require confirmation and remove its downloaded rules.	Source edit delete action shows a confirmation dialog, cancel leaves source and downloaded rules intact, and confirm deletes the source plus cascades its downloaded hosts_lists rows.	app/src/main/java/org/adaway/ui/source/SourceEditActivity.java; app/src/main/java/org/adaway/db/entity/HostListItem.java; app/src/androidTest/java/org/adaway/ui/source/SourceEditAddEditInstrumentedTest.java	app/src/androidTest/java/org/adaway/ui/source/SourceEditAddEditInstrumentedTest.java	Covered by connected UI flow	Focused connected delete-source method and full SourceEditAddEditInstrumentedTest passed locally; PR CI passed on 9b4a7b6f	P1	Destructive path now has cancel, confirm, cascade cleanup, and source-card removal proof; external release/root/VPN/hardware gates remain separate.			Verified existing behavior with destructive UI coverage	Focused connected method passed 1 test; full SourceEditAddEditInstrumentedTest passed 2 tests on adaway-api34-16g; PR #6 connected Android tests passed on 9b4a7b6f
LIST-001	Your Lists	Blocked allowed redirected tabs	As a user I want separate tabs for blocked allowed and redirected rules.	ListsActivity hosts pager tabs for blocked allowed and redirected fragments, selects the requested bottom-navigation item, and each tab renders only rules for its own list type including redirected IP subtext.	app/src/main/java/org/adaway/ui/lists/ListsActivity.java; app/src/main/java/org/adaway/ui/lists/ListsFragmentPagerAdapter.java; app/src/main/java/org/adaway/ui/lists/type/BlockedHostsFragment.java; app/src/main/java/org/adaway/ui/lists/type/AllowedHostsFragment.java; app/src/main/java/org/adaway/ui/lists/type/RedirectedHostsFragment.java; app/src/main/res/menu/lists_navigation.xml; app/src/androidTest/java/org/adaway/ui/lists/ListsTabsInstrumentedTest.java	app/src/androidTest/java/org/adaway/ui/UxDeviceMatrixTest.java; app/src/androidTest/java/org/adaway/ui/lists/ListsTabsInstrumentedTest.java	Covered by tests	Focused connected list-tab test passed locally after private test-database isolation; unit/android-test compile gate and full connected suite passed with JDK 21; branch-tip PR CI recheck pending	P0	Core rule management. Direct tab selection and per-type rendered test rows covered; broader edit/delete/add flows are tracked by LIST-003/LIST-004/LIST-005/LIST-006. ccf571d2 full connected CI exposed test fixture state leakage rather than a production tab defect.			Verified existing behavior; fixed test isolation	CI failed on ccf571d2 because ListsTabsInstrumentedTest waited for a visible row in shared full-suite DB state. Fixed test owns a private Room DB, preflights runtime query visibility, focused ListsTabsInstrumentedTest ran 1 test, local Gradle gate passed, and full local connectedDebugAndroidTest finished 135 tests with 0 failures on adaway-api34.
LIST-002	Your Lists	Search rules	As a user I want to search my rule lists by domain.	AbstractListFragment search field updates ListsViewModel search query and state.	app/src/main/java/org/adaway/ui/lists/type/AbstractListFragment.java; app/src/main/java/org/adaway/ui/lists/ListsViewModel.java	app/src/test/java/org/adaway/ui/lists/ListsSearchBarTest.java; app/src/androidTest/java/org/adaway/ui/lists/ListsSearchInstrumentedTest.java	Covered by connected UI flow	Connected blocked-list search field flow passed for matching result filtering and no-match empty state	P1	Large lists need search; the real search field path is now device-proven on seeded blocked rules.	UX-OPEN-LISTS-SEARCH-UI	No production defect found; the gap was missing device proof that the fragment search field drives ListsViewModel filtering and the no-match state.	Device-proven existing behavior	Focused connected ListsSearchInstrumentedTest passed 1 test on adaway-api34-16g
LIST-003	Your Lists	Add user rule	As a user I want to add blocked allowed or redirected host rules.	Each list fragment opens add dialogs and stores enabled user-source HostListItem rows; blocked supports valid multiline hosts, allowed supports valid wildcard hosts, redirected requires a valid host and public redirect IP.	app/src/main/java/org/adaway/ui/lists/type/BlockedHostsFragment.java; app/src/main/java/org/adaway/ui/lists/type/AllowedHostsFragment.java; app/src/main/java/org/adaway/ui/lists/type/RedirectedHostsFragment.java; app/src/main/java/org/adaway/ui/lists/ListsActivity.java; app/src/main/java/org/adaway/ui/lists/ListsViewModel.java; app/src/main/java/org/adaway/util/RegexUtils.java; app/src/main/java/org/adaway/model/backup/BackupFormat.java	app/src/androidTest/java/org/adaway/db/UserListTest.java; app/src/test/java/org/adaway/ui/lists/type/RedirectedHostsValidationContractTest.java; app/src/androidTest/java/org/adaway/ui/lists/ListsAddUserRulesInstrumentedTest.java	Covered by connected UI flow	Connected add-dialog flow passed for blocked allowed and redirected user rules	P0	UI add path is device-proven for one blocked host, one wildcard allowed host, and one redirected host with public IP; edit/delete and validation-negative UI cases remain separate LIST-004 and follow-up LIST-003 hardening.	UX-OPEN-REDIRECT-IP	Redirected-rule UI accepted any syntactically valid IP; fixed earlier by sharing the valid public redirect-IP policy with backup import. This loop added direct device proof that FAB/dialog add stores user-source rows for all three list types.	Connected add-flow proof added	Focused ListsAddUserRulesInstrumentedTest and full connected suite passed
LIST-004	Your Lists	Edit delete user rule	As a user I want to edit or delete my rules and confirm destructive deletes.	Action mode shows edit and delete only for user-source rows and delete requires confirmation before removing a user rule.	app/src/main/java/org/adaway/ui/lists/type/AbstractListFragment.java; app/src/main/res/menu/checkbox_list_context.xml	app/src/androidTest/java/org/adaway/db/UserListTest.java; app/src/androidTest/java/org/adaway/ui/lists/ListsRuleActionsInstrumentedTest.java	Covered by connected UI flow	Connected edit cancel-delete and confirm-delete flow passed	P1	Accidental deletes are painful; edit persistence and destructive confirmation are now device-proven through real action-mode menu and dialogs.	UX-OPEN-LIST-RULE-ACTIONS	List mutation actions had DB coverage but no connected UI proof for action-mode edit/delete and destructive confirmation.	UI proof added	Focused connected ListsRuleActionsInstrumentedTest passed 2 tests on adaway-api34-16g
LIST-005	Your Lists	Toggle rule enabled	As a user I want to enable or disable individual rules.	List rows toggle user items through ListsAdapter and AbstractListFragment, and downloaded item toggles route through the override prompt.	app/src/main/java/org/adaway/ui/lists/type/ListsAdapter.java; app/src/main/java/org/adaway/ui/lists/type/AbstractListFragment.java; app/src/main/java/org/adaway/ui/lists/ListsViewModel.java	app/src/androidTest/java/org/adaway/db/UserListTest.java; app/src/androidTest/java/org/adaway/ui/lists/ListsRuleActionsInstrumentedTest.java	Fixed and covered by connected UI flow	Connected user-row toggle and downloaded override toggle flow passed	P1	Toggle semantics are subtle because user rows mutate enabled state while downloaded rows create user overrides.	UX-OPEN-LIST-ROW-TOGGLE	List row switches were non-clickable by layout and the row itself had no click listener, so ordinary users could not toggle individual rules.	Fixed row click toggle path	Focused connected ListsRuleActionsInstrumentedTest passed 2 tests on adaway-api34-16g after red harness/debug runs
LIST-006	Your Lists	Downloaded rule override	As a user I want to override a downloaded block rule without editing the source.	Turning off a downloaded item prompts with localized copy and creates an enabled user allow-rule override while disabling the downloaded row.	app/src/main/java/org/adaway/ui/lists/type/AbstractListFragment.java; app/src/main/res/values/strings_lists.xml; app/src/main/java/org/adaway/ui/lists/ListsViewModel.java	app/src/androidTest/java/org/adaway/ui/lists/ListsRuleActionsInstrumentedTest.java	Covered by connected UI flow	Connected downloaded-rule override prompt and DB effect passed	P1	Breakage rescue path; downloaded source content remains immutable while the user override is applied separately.	UX-OPEN-LIST-DOWNLOADED-OVERRIDE	Downloaded override prompt lacked connected behavior proof and used hardcoded English copy.	Override prompt localized and proof added	Focused connected ListsRuleActionsInstrumentedTest passed 2 tests on adaway-api34-16g
