story_id	area	feature	user_story	expected_behavior	code_evidence	existing_test_evidence	status	test_state	priority	risk_notes	error_id	error_notes	fix_status	retest_status
LIST-007	Your Lists	Loading empty error states	As a user I want clear empty retry and no-match states.	ListsUiState shows loading copy while the first page loads, a retryable failure state when refresh fails, no-rules copy when empty, and no-match copy when search filters out rules.	app/src/main/java/org/adaway/ui/lists/type/AbstractListFragment.java; app/src/main/java/org/adaway/ui/lists/type/ListsUiState.java; app/src/main/res/layout/hosts_lists_fragment.xml; app/src/main/res/values/strings_lists.xml	app/src/test/java/org/adaway/ui/lists/type/ListsUiStateTest.java; app/src/androidTest/java/org/adaway/ui/lists/ListsSearchInstrumentedTest.java	Covered by connected UI flow	JVM state/layout contract passed; connected ListsSearchInstrumentedTest passed 3 tests proving empty, no-match, induced Paging load-failure, visible Retry, and recovery after retry.	P2	Polish and accessibility; avoids a blank Your Lists content well during initial load and gives users a retry path when the first page fails.	LIST-007-BLANK-LOADING	Loading previously resolved to HIDDEN, leaving Your Lists blank during initial refresh; failure/retry now has induced Paging failure device proof.	Loading state spinner/copy added; empty/no-match/failure/retry device proof added	ListsUiStateTest passed; connected ListsSearchInstrumentedTest passed 3 tests on adaway-api34-16g
RUNTIME-001	Update Pipeline	Download parse insert apply	As a user I want updating lists to download parse store and apply protection atomically.	SourceModel coordinates source retrieval and AdBlockModel.apply installs runtime rules.	app/src/main/java/org/adaway/model/source/SourceModel.java; app/src/main/java/org/adaway/model/source/SourceLoader.java; app/src/main/java/org/adaway/model/adblocking/AdBlockModel.java	app/src/androidTest/java/org/adaway/model/source/SourceModelGenerationFailureTest.java; app/src/androidTest/java/org/adaway/ui/home/HomeUpdateActionsInstrumentedTest.java	Covered by connected UI flow	Connected Home update/apply pipeline proof passed	P0	Heart of the app; root write and VPN tunnel smoke remain separately tracked by RUNTIME-007 and RUNTIME-008.	UX-OPEN-RUNTIME-UPDATE-APPLY-PROOF	RUNTIME-001 had preservation tests but no connected user-path proof that update actions download parse insert activate runtime truth and only then call apply.	Device-proven existing behavior	Focused HomeUpdateActionsInstrumentedTest passed 2 tests with active generation source stats host_entries counts and apply-boundary assertions; standard Gradle gate and full connected suite passed 167 tests with 3 skipped on adaway-api34.
RUNTIME-000	Runtime Method	Ad-block method dispatch	As a user I want the selected root or VPN mode to create the correct blocking runtime.	AdBlockModel builds the active model from selected AdBlockMethod and preferences switch through onboarding.	app/src/main/java/org/adaway/model/adblocking/AdBlockModel.java; app/src/main/java/org/adaway/AdAwayApplication.java; app/src/main/java/org/adaway/ui/prefs/PrefsMainFragment.java	app/src/androidTest/java/org/adaway/model/adblocking/AdBlockModelDispatchTest.java; app/src/test/java/org/adaway/ui/onboarding/OnboardingFirstRunContractTest.java	Covered by tests	Focused connected dispatch test passed locally; local unit and android-test compile gate passed; PR CI passed	P0	Dispatch coverage proves undefined root and VPN model selection plus app-level cache rebuild; root hosts apply and VPN TUN smoke remain separately tracked.			Verified existing behavior	Focused connected AdBlockModelDispatchTest ran 2 tests on adaway-api34; local Gradle gate passed; PR CI passed on c8d9fadb
RUNTIME-002	Update Pipeline	Conditional GET	As a user I want unchanged lists to skip download work while retaining protection.	Source HTTP handling supports ETag Last-Modified and 304 carry-forward behavior.	app/src/main/java/org/adaway/model/source/SourceModel.java; app/src/main/java/org/adaway/db/entity/HostsSource.java	app/src/androidTest/java/org/adaway/model/source/SourceModelHttpConditionalTest.java; app/src/test/java/org/adaway/model/source/Generation304MigrationTest.java	Covered by connected mixed-network flow	Connected mixed 200/304/500 conditional GET proof passed	P0	304 bugs can drop coverage; broad update/apply proof remains covered by RUNTIME-001.	UX-OPEN-RUNTIME-CONDITIONAL-MIXED-NETWORK	Existing mixed-network preservation coverage did not assert conditional request headers for every source in the mixed 200/304/failure run, and the spreadsheet still marked the story as needing proof.	Proof strengthened	Focused SourceModelHttpConditionalTest passed 4 tests with mixed 200/304/500 request-header and preservation assertions after an initial test-scope failure; standard Gradle gate and full connected suite passed 167 tests with 3 skipped on adaway-api34.
RUNTIME-003	Update Pipeline	Failed-source preservation	As a user I want a failed source update not to erase currently active rules.	Full-update pipeline directly carries forward failed sources, dedupe-carries 304 sources, activates only a complete staging generation, and records failed-source metadata.	app/src/main/java/org/adaway/model/source/SourceModel.java; app/src/main/java/org/adaway/db/dao/HostEntryDao.java	app/src/androidTest/java/org/adaway/model/source/SourceModelGenerationFailureTest.java; app/src/androidTest/java/org/adaway/model/source/SourceModelHttpConditionalTest.java; app/src/test/java/org/adaway/model/source/Generation304MigrationTest.java	Covered by tests	Connected CI passed mixed 200/304/HTTP 500 preservation on b1d0b99c; focused and full local gates passed	P0	P0 correctness risk; broader runtime mutation matrix still open.	UX-OPEN-RUNTIME-MIXED-UPDATE-PRESERVATION	HTTP 500 responses were accepted as parseable successful responses when a body existed, bypassing failed-source carry-forward and activating a zero-row staging source.	Fixed	Connected CI passed on b1d0b99c; full PR checks green
RUNTIME-004	Runtime Truth	Active generation sync	As a user I want runtime host_entries to include user rules and active-generation source rows only.	HostEntryDao and RootHost export queries resolve active runtime truth.	app/src/main/java/org/adaway/db/dao/HostEntryDao.java; app/src/main/java/org/adaway/db/ActiveRootHostsCursor.java	app/src/androidTest/java/org/adaway/db/HostDbTest.java; app/src/androidTest/java/org/adaway/db/SourceDbTest.java; app/src/androidTest/java/org/adaway/ui/domainchecker/DomainCheckerRuntimeTruthTest.java; app/src/androidTest/java/org/adaway/model/source/SourceModelRuntimeTruthMutationTest.java	Covered by tests	Connected SourceModel mutation-matrix proof passed for user allow insert/delete and source disable/enable with active, stale, and future generation rows on 52188300	P0	Stale rows can leak or overblock.	UX-OPEN-RUNTIME-ACTIVE-GENERATION-MUTATION-MATRIX	No production defect found; missing proof was closed by connected mutation-matrix coverage.	Verified existing behavior	Focused android-test compile and full local Gradle gate passed; PR connected tests and full checks green on 52188300
RUNTIME-005	Parser	Hosts and DNS rule parsing	As a user I want supported hosts DNS RPZ dnsmasq unbound and suffix rules interpreted safely.	SourceLoader extracts exact and suffix rules and skips unsupported unsafe semantics.	app/src/main/java/org/adaway/model/source/SourceLoader.java; app/src/main/java/org/adaway/db/entity/RuleKind.java	app/src/test/java/org/adaway/model/source/SourceLoaderParserPatternsTest.java; app/src/test/java/org/adaway/model/source/SourceLoaderTest.java; app/src/androidTest/java/org/adaway/model/source/SourceLoaderDatabaseSemanticsTest.java	Covered by tests	Added parser matrix for DNS trailing-root-dot normalization, block-safe Unbound local-zone and local-data targets, unanchored ABP path/options skips, parse-to-DB RuleKind/skipped-row proof, redirect-enabled RPZ fallback, and dnsmasq inline-comment/normalization/safety cases; focused parser gate and full local JVM/android-test compile passed; PR CI passed on 5a3fb656	P0	Parser semantics define protection correctness.	UX-OPEN-PARSER-UNSAFE-FLATTENING	No remaining parser matrix gap is tracked locally; unsupported browser options, path rules, routing rules, unsafe redirects, and malformed dnsmasq shapes are intentionally skipped.	Fixed unsafe parser flattening, Unbound local-data target safety, redirect-enabled RPZ fallback, parse-to-DB proof, and dnsmasq formatting matrix	Focused parser gate and full local Gradle gate passed; PR checks green on 5a3fb656
RUNTIME-006	Runtime Truth	Exact and suffix matching	As a user I want exact and domain-suffix rules to work in both root export and VPN lookup.	RuleKind EXACT and SUFFIX are stored and HostEntryDao builds suffix-aware runtime data.	app/src/main/java/org/adaway/db/entity/RuleKind.java; app/src/main/java/org/adaway/db/dao/HostEntryDao.java	app/src/test/java/org/adaway/model/backup/BackupFormatSecurityTest.java; app/src/androidTest/java/org/adaway/model/vpn/VpnModelCacheInvalidationTest.java; app/src/androidTest/java/org/adaway/vpn/dns/DnsPacketProxyRuntimeTruthTest.java; app/src/androidTest/java/org/adaway/db/SourceDbTest.java	Covered by tests	Connected DNS proxy suffix lookup proof passed locally on adaway-api34; VpnModel cache invalidation and SourceDb exact/suffix runtime coverage already exist; full local JVM/android-test compile gate passed; PR CI passed on 9eeb441f	P0	Suffix mismatch causes visible leaks.	UX-OPEN-RUNTIME-VPN-SUFFIX-LOOKUP	No production defect found; missing proof was closed by connected DNS packet proxy coverage.	Verified existing behavior	Focused connected DNS proxy test and full local Gradle gate passed; PR checks green on 9eeb441f
RUNTIME-007	Root Blocking	Root hosts apply	As a rooted user I want AdAway to write the effective hosts file and remount safely.	RootModel applies root hosts entries and handles remount shell operations.	app/src/main/java/org/adaway/model/root/RootModel.java; app/src/main/java/org/adaway/model/root/ShellUtils.java; tasks/benchmarks/2026-06-27-runtime007-root-hosts-apply-blocker.md	app/src/androidTest/java/org/adaway/db/HostDbTest.java	Partially covered	Needs rooted writable-system device smoke; API 34 emulator root shell was probed but rejected as hosts-apply proof because remount and direct /system/etc/hosts write failed read-only	P0	Requires a real rooted environment where AdAway/libsu can write /system/etc/hosts and restore it; root shell alone is not enough.	RUNTIME-007-ROOT-FS-READONLY	adaway-api34-16g accepted adb root and su 0 id, but adb remount required bootloader unlock, avbctl disable-verification failed writing vbmeta, direct hosts write failed read-only, and writable-system launch did not provide a usable target.	Blocked on writable rooted target	Root probe documented in tasks/benchmarks/2026-06-27-runtime007-root-hosts-apply-blocker.md; no RootModel.apply smoke accepted
RUNTIME-008	VPN Blocking	Local VPN DNS blocking	As a non-root user I want the local VPN to intercept DNS and block allow or redirect domains.	VpnService starts VpnWorker which uses DNS proxy and HostEntry runtime data.	app/src/main/java/org/adaway/vpn/VpnService.java; app/src/main/java/org/adaway/vpn/worker/VpnWorker.java; app/src/main/java/org/adaway/vpn/worker/VpnPacketProcessor.java; app/src/main/java/org/adaway/vpn/dns/DnsPacketProxy.java	app/src/test/java/org/adaway/vpn/worker/VpnWorkerIdleTimeoutTest.java; app/src/test/java/org/adaway/vpn/dns/DnsQueryQueueTest.java; app/src/test/java/org/adaway/vpn/worker/VpnPacketProcessorTest.java; app/src/androidTest/java/org/adaway/vpn/dns/DnsPacketProxyRuntimeTruthTest.java; app/src/test/java/org/adaway/ui/onboarding/OnboardingFirstRunContractTest.java; app/src/test/java/org/adaway/ui/home/HomeNavigationSourcesContractTest.java	Covered by connected smoke	Fresh API 34 first-run VPN consent and TUN smoke passed; worker/proxy packet seams remain covered	P0	Primary non-root mode is now emulator-proven through Android consent, AdAway-owned tun0, VpnWorker RUNNING, and Home active/running UI; physical-device VPN smoke remains part of release smoke.	UX-OPEN-RUNTIME-VPN-CONSENT-TUN	Accepted first-run Android VPN consent saved VPN mode and launched Home without applying the shared VPN model, leaving the tunnel stopped or Home/leak status stale.	Fixed first-run VPN apply and Home leak refresh	Fresh uninstall/reinstall smoke on adaway-api34-16g showed consent dialog, Home Protection active, leak status VPN running, dumpsys vpn active package org.adaway, connectivity VPN CONNECTED InterfaceName tun0 OwnerUid 10195; focused JVM contracts passed
RUNTIME-009	VPN Blocking	VPN lifecycle watchdog	As a user I want the VPN service to stop restart and recover cleanly.	VpnServiceControls VpnServiceHeartbeat VpnWatchdog and throttler manage lifecycle and restarts.	app/src/main/java/org/adaway/vpn/VpnServiceControls.java; app/src/main/java/org/adaway/vpn/VpnServiceHeartbeat.java; app/src/main/java/org/adaway/vpn/worker/VpnWatchdog.java; app/src/main/java/org/adaway/vpn/worker/VpnConnectionMonitor.java	app/src/test/java/org/adaway/vpn/worker/VpnWatchdogTest.java; app/src/test/java/org/adaway/vpn/worker/VpnConnectionMonitorTest.java; app/src/test/java/org/adaway/vpn/worker/VpnWorkerIdleTimeoutTest.java; app/src/androidTest/java/org/adaway/vpn/VpnLifecycleInstrumentedTest.java; tasks/benchmarks/2026-06-27-runtime009-vpn-lifecycle-boundary.md	Partially covered by automated and prepared-device proof	JVM monitor recovery and idle/watchdog proof passed; connected heartbeat start stop proof passed; full tunnel start stop resume method is implemented but intentionally skips unless AdAway VPN consent is already granted and no other VPN is active	P1	Service lifecycle is Android-fragile; full live tunnel proof remains a manual or prepared-device release smoke boundary, not a claim from skipped instrumentation.	RUNTIME-009-MONITOR-RESET	Connection monitor reset left the stopped flag false after recovery stop, so a recovered VPN could reuse an inactive monitor loop.	Fixed monitor re-arm; prepared-device boundary documented	Focused JVM monitor/watchdog/idle tests passed; connected VpnLifecycleInstrumentedTest heartbeat path passed on adaway-api34-16g and full lifecycle skip reason is documented in tasks/benchmarks/2026-06-27-runtime009-vpn-lifecycle-boundary.md
RUNTIME-011	VPN Blocking	DNS packet enforcement	As a VPN user I want DNS requests blocked allowed redirected or forwarded according to runtime truth.	DnsPacketProxy parses DNS packets and synthesizes block or redirect answers or forwards allowed queries.	app/src/main/java/org/adaway/vpn/dns/DnsPacketProxy.java; app/src/main/java/org/adaway/model/vpn/VpnModel.java	app/src/androidTest/java/org/adaway/model/vpn/VpnModelCacheInvalidationTest.java; app/src/androidTest/java/org/adaway/vpn/dns/DnsPacketProxyRuntimeTruthTest.java	Covered by tests	Focused connected DNS proxy packet test passed locally; local unit and android-test compile gate passed; PR CI passed	P0	Packet-level enforcement now covers suffix block exact block default forward and exact redirect; rooted hosts apply remains separately tracked in RUNTIME-007.			Verified existing behavior	Focused connected DnsPacketProxyRuntimeTruthTest ran 4 tests on adaway-api34; local Gradle gate passed; PR CI passed on 7da85aed
RUNTIME-012	VPN Blocking	DNS server and DoH routing	As a VPN user I want common encrypted DNS routes covered without false guarantees.	DnsServerMapper maps real DNS servers and routes common DoH provider IPs while copy discloses finite coverage.	app/src/main/java/org/adaway/vpn/dns/DnsServerMapper.java; app/src/main/res/values/strings_home.xml	app/src/test/java/org/adaway/security/SecurityHardeningTest.java; app/src/test/java/org/adaway/vpn/dns/DnsServerMapperDohRoutesTest.java; app/src/androidTest/java/org/adaway/ui/home/HomeLeakStatusInstrumentedTest.java	Covered by route-plan and leak UI tests	Common DoH route-plan and leak-status scenario proof passed	P0	Provider list is finite and other encrypted DNS may bypass; real VPN tunnel interception remains tracked by RUNTIME-008.	UX-OPEN-RUNTIME-DOH-ROUTE-PLAN	DoH route coverage was guarded only by source-text checks and Home risk copy; no behavior test proved the common IPv4/IPv6 host route plan that production VPN configuration applies.	Proof strengthened	Added route-plan unit proof for eight IPv4 /32 and eight IPv6 /128 common DoH provider routes, updated the security guard to assert production uses that plan, reran connected Home leak-status UI risk scenario, standard Gradle gate, and full connected suite with 167 tests and 3 skipped on adaway-api34.
RUNTIME-010	Performance	Large update scale	As a power user I want 100k 1M and 5M rule updates without ANR or memory blowup.	SourceLoaderPerformanceTest measures update and root export paths.	app/src/androidTest/java/org/adaway/model/source/SourceLoaderPerformanceTest.java; app/src/main/java/org/adaway/db/dao/HostEntryDao.java	app/src/androidTest/java/org/adaway/model/source/SourceLoaderPerformanceTest.java	Covered by connected benchmark	Fresh 100k 1M and 5M full parse sync root-write benchmarks passed	P0	Fresh 5M full pipeline passed on adaway-api34-16g with parseMs=124749 syncMs=8739 rootWriteMs=2476; broader release gates remain separate.	PERF-OPEN-RUNTIME-010-STAGE	Full parse/import previously never populated root_host_entries_stage, so 1M fell back to the slow direct root-export path; fixed staging plus stage-backed duplicate skip.	Verified in working tree	Fresh 5M connected benchmark passed 1 test on adaway-api34-16g; final metric lines=5000000 inserted=4750000 runtimeRows=4500000 rootRows=4500000 rootWriteBytes=150601774
DOMAIN-001	Domain Checker	Check domain result	As a user I want to enter a domain and know whether it is blocked allowed redirected or unknown.	DomainCheckerViewModel queries final runtime truth and produces DomainCheckResult.	app/src/main/java/org/adaway/ui/domainchecker/DomainCheckerFragment.java; app/src/main/java/org/adaway/ui/domainchecker/DomainCheckerViewModel.java; app/src/main/java/org/adaway/ui/domainchecker/DomainCheckResult.java	app/src/test/java/org/adaway/ui/domainchecker/DomainCheckerTest.java; app/src/androidTest/java/org/adaway/ui/domainchecker/DomainCheckerRuntimeTruthTest.java	Covered by connected UI flow	Connected UI proof renders blocked allowed redirected and unknown runtime states	P1	Diagnostics must match runtime; broader UX matrix sign-off remains under REL-004.	DOMAIN-001-STATUS-STATE	Domain Checker collapsed allowed redirected and unknown into blocked/not-blocked UI states, hiding runtime-truth distinctions.	Runtime status rendering added	Focused DomainCheckerTest passed; connected DomainCheckerRuntimeTruthTest passed on adaway-api34 in the 9-test diagnostics/system batch
DOMAIN-002	Domain Checker	Normalize input	As a user I want pasted domains with case IDNA or trailing dots normalized.	DomainNormalizer normalizes checker input before lookup and the real Domain Checker UI accepts messy pasted URLs with whitespace uppercase trailing dot port path query and fragment before rendering the normalized host result.	app/src/main/java/org/adaway/ui/domainchecker/DomainNormalizer.java; app/src/main/java/org/adaway/ui/domainchecker/DomainCheckerViewModel.java; app/src/androidTest/java/org/adaway/ui/domainchecker/DomainCheckerRuntimeTruthTest.java	app/src/test/java/org/adaway/ui/domainchecker/DomainNormalizerTest.java; app/src/androidTest/java/org/adaway/ui/domainchecker/DomainCheckerRuntimeTruthTest.java	Covered by unit and connected UI flow	Connected pasted URL normalization flow passed	P2	Small UX detail is now device-proven for a realistic pasted URL; broader manual input matrix remains separate.			Verified existing behavior with UI proof	Focused connected DomainCheckerRuntimeTruthTest normalization method passed in the 4-test connected batch on adaway-api34-16g
DOMAIN-003	Domain Checker	Advice and mutation	As a user I want actionable advice for a domain result without accidental unsafe changes.	Domain Checker stays a non-AI runtime-truth tool; visible actions add normalized user allow rules, remove user allow rules, add normalized user block rules, and delete user block rules without mutating downloaded source rows.	app/src/main/java/org/adaway/ui/domainchecker/DomainCheckerViewModel.java; app/src/main/java/org/adaway/ui/domainchecker/DomainCheckerFragment.java; app/src/androidTest/java/org/adaway/ui/domainchecker/DomainCheckerRuntimeTruthTest.java	app/src/test/java/org/adaway/ui/domainchecker/DomainCheckerViewModelAdviceTest.java; app/src/test/java/org/adaway/ui/home/AiSurfaceContractTest.java; app/src/androidTest/java/org/adaway/ui/domainchecker/DomainCheckerRuntimeTruthTest.java	Covered by connected UI flow	Connected Domain Checker actions flow passed for pasted-input normalization, allow, remove allow, block, delete user rule, Room user-rule effects, runtime truth effects, and visible status refresh	P1	No-AI scope is explicit and guarded by AiSurfaceContractTest; connected action proof covers user-rule mutation but not external release/root-device smoke.	DOMAIN-003-ACTIONS-PROOF	Domain Checker advice and action buttons had unit/runtime rendering coverage but lacked direct connected proof that visible actions mutate only normalized user rules after the AI feature cut.	Device action proof added	Compile passed; focused DomainCheckerRuntimeTruthTest passed 4 connected tests on adaway-api34-16g; DomainCheckerViewModelAdviceTest and AiSurfaceContractTest JVM tests passed
LOG-001	DNS Log	View DNS requests	As a user I want to inspect DNS requests observed by the VPN.	LogActivity displays LogEntry rows from VPN DNS logging.	app/src/main/java/org/adaway/ui/log/LogActivity.java; app/src/main/java/org/adaway/ui/log/LogViewModel.java; app/src/androidTest/java/org/adaway/vpn/worker/VpnPacketProcessorRuntimeTruthTest.java; app/src/androidTest/java/org/adaway/vpn/dns/DnsPacketTestFixtures.java	app/src/androidTest/java/org/adaway/ui/UxDeviceMatrixTest.java; app/src/androidTest/java/org/adaway/ui/log/LogRuntimeTruthTest.java; app/src/androidTest/java/org/adaway/vpn/worker/VpnPacketProcessorRuntimeTruthTest.java	Covered by connected packet bridge proof	Packet processor DNS query for a blocked host queues a device response, records the VPN log entry, and LogActivity renders the host	P1	Useful diagnosis feature is now packet-bridge proven; live consented TUN traffic remains covered by the broader VPN runtime gates.	LOG-001-PACKET-BRIDGE-PROOF	Prior proof stopped at direct VpnModel log generation and did not prove the DNS packet processor/proxy boundary feeds visible Log UI.	Packet bridge proof added	Connected VpnPacketProcessorRuntimeTruthTest passed 1 test on adaway-api34-16g
LOG-002	DNS Log	Sort and group log entries	As a user I want DNS logs sorted usefully such as by top-level domain.	LogEntrySort provides comparators for log ordering and LogActivity routes the sort menu action through LogViewModel.toggleSort.	app/src/main/java/org/adaway/ui/log/LogEntrySort.java; app/src/main/java/org/adaway/ui/log/LogAdapter.java; app/src/main/java/org/adaway/ui/log/LogActivity.java; app/src/main/java/org/adaway/ui/log/LogViewModel.java	app/src/test/java/org/adaway/ui/log/LogEntrySortTest.java; app/src/test/java/org/adaway/ui/log/LogSortActionContractTest.java	Covered by JVM contracts	Comparator and sort-action routing contracts passed; connected toolbar tap remains a possible polish follow-up	P2	Usability polish; source-contract proof guards the menu wiring but does not replace a future visual/device toolbar pass.	LOG-002-SORT-ACTION	Sort comparator coverage existed, but no proof kept the visible menu action wired to ViewModel resorting.	Source contract added	Focused LogSortActionContractTest plus existing LogEntrySortTest passed in JVM batch
LOG-003	DNS Log	Redirect rule from log	As a user I want to create a redirect or rule from a logged request.	Log UI row actions open the redirect dialog, validate redirect targets with the shared public-IP policy, store enabled redirected user rules, and expose distinct redirect action copy for accessibility.	app/src/main/java/org/adaway/ui/log/LogActivity.java; app/src/main/res/layout/log_redirect_dialog.xml; app/src/main/res/layout/log_entry.xml	app/src/androidTest/java/org/adaway/ui/log/LogRuntimeTruthTest.java; app/src/test/java/org/adaway/ui/lists/type/RedirectedHostsValidationContractTest.java	Fixed and covered by connected UI flow	Connected LogRuntimeTruthTest passed for VPN-generated log row, redirect icon click, redirect dialog, public-IP entry, and Room redirected user-rule insert; JVM contract guards the stricter redirect-IP validator and redirect action content description.	P2	Advanced diagnostic action; private/reserved redirect targets are now rejected through the same policy as the redirected-host editor.	LOG-003-REDIRECT-POLICY	DNS-log redirect dialog accepted any syntactically valid IP and the redirect icon reused allowlist accessibility copy.	Redirect validator and action copy fixed	Compile passed; focused redirect connected method passed 1 test; full LogRuntimeTruthTest passed 2 connected tests; RedirectedHostsValidationContractTest passed.
